{
  "openfood_version": "0.2.0",
  "generated_at": "2026-07-16T12:00:00Z",
  "restaurant": {
    "id": "r123",
    "name": {
      "en": "Green Garden",
      "he": "גן ירוק"
    },
    "description": {
      "en": "Plant-forward Mediterranean kitchen in the heart of Tel Aviv",
      "he": "מטבח ים תיכוני מבוסס צמחים בלב תל אביב"
    },
    "location": {
      "address": "Rothschild Blvd 12",
      "city": "Tel Aviv",
      "country": "IL",
      "geo": { "lat": 32.0632, "lng": 34.7719 }
    },
    "currency": "ILS",
    "default_language": "en",
    "languages": ["en", "he", "fr"],
    "cuisines": ["mediterranean", "vegetarian"],
    "contact": {
      "phone": "+972-3-1234567",
      "website": "https://greengarden.example"
    },
    "links": {
      "google_maps": "https://www.google.com/maps/place/?q=place_id:ChIJdWEbeCZLHRURW-a1hL7Xyx0"
    },
    "hours": {
      "sun": [{ "start": "09:00", "end": "23:00" }],
      "mon": [{ "start": "09:00", "end": "23:00" }],
      "tue": [{ "start": "09:00", "end": "23:00" }],
      "wed": [{ "start": "09:00", "end": "23:00" }],
      "thu": [{ "start": "09:00", "end": "23:00" }],
      "fri": [
        { "start": "09:00", "end": "15:00" }
      ]
    },
    "certifications": ["kosher"]
  },
  "categories": [
    {
      "id": "c1",
      "name": { "en": "Starters", "he": "ראשונות" },
      "sort_order": 0
    },
    {
      "id": "c2",
      "name": { "en": "Main Dishes", "he": "עיקריות" },
      "sort_order": 1
    }
  ],
  "menu": [
    {
      "id": "d1001",
      "name": {
        "en": "Vegan Buddha Bowl",
        "he": "קערת בודהה טבעונית"
      },
      "description": {
        "en": "Quinoa, chickpeas, roasted veggies, tahini dressing",
        "he": "קינואה, חומוס, ירקות צלויים, רוטב טחינה"
      },
      "category_id": "c2",
      "sort_order": 0,
      "price": 48.0,
      "nutritional_info": {
        "calories": 520,
        "protein": 18,
        "fat": 20,
        "carbohydrates": 60,
        "sugar": 6
      },
      "allergens": ["sesame"],
      "tags": ["vegan", "gluten-free"],
      "ingredients": [
        { "name": "quinoa", "amount_grams": 150 },
        { "name": "chickpeas", "amount_grams": 100 },
        { "name": "roasted sweet potato", "amount_grams": 120 },
        { "name": "roasted bell peppers", "amount_grams": 80 },
        { "name": "fresh spinach", "amount_grams": 50, "raw_or_cooked": "raw" },
        { "name": "tahini", "amount_grams": 30 }
      ]
    },
    {
      "id": "d1002",
      "name": {
        "en": "Mediterranean Salad",
        "he": "סלט ים תיכוני"
      },
      "description": {
        "en": "Fresh tomatoes, cucumbers, olives, feta cheese, olive oil dressing"
      },
      "category_id": "c1",
      "sort_order": 0,
      "price": 32.0,
      "nutritional_info": {
        "calories": 320,
        "protein": 10,
        "fat": 24,
        "carbohydrates": 15,
        "sugar": 8
      },
      "allergens": ["milk"],
      "tags": ["vegetarian", "gluten-free"],
      "ingredients": [
        { "name": "tomatoes", "amount_grams": 120, "raw_or_cooked": "raw" },
        { "name": "cucumbers", "amount_grams": 100, "raw_or_cooked": "raw" },
        { "name": "olives", "amount_grams": 40 },
        { "name": "feta cheese", "amount_grams": 60 },
        { "name": "olive oil", "amount_grams": 15 },
        { "name": "lemon juice", "amount_grams": 10, "raw_or_cooked": "raw" }
      ]
    },
    {
      "id": "d1003",
      "name": {
        "en": "Tofu Stir-Fry",
        "fr": "Sauté de Tofu"
      },
      "description": {
        "en": "Tofu with seasonal vegetables in teriyaki sauce",
        "fr": "Tofu avec légumes de saison dans une sauce teriyaki"
      },
      "category_id": "c2",
      "sort_order": 1,
      "price": 42.0,
      "nutritional_info": {
        "calories": 380,
        "protein": 22,
        "fat": 16,
        "carbohydrates": 35,
        "sugar": 12
      },
      "allergens": ["soybeans", "gluten"],
      "tags": ["vegan"],
      "ingredients": [
        { "name": "tofu", "amount_grams": 200 },
        { "name": "broccoli", "amount_grams": 100 },
        { "name": "bell peppers", "amount_grams": 80 },
        { "name": "carrots", "amount_grams": 70 },
        { "name": "teriyaki sauce", "amount_grams": 40 }
      ],
      "modifications": [
        {
          "id": "m1",
          "name": "Rice choice",
          "type": "option",
          "is_required": true,
          "max_selections": 1,
          "options": [
            {
              "id": "o1",
              "name": { "en": "White rice", "fr": "Riz blanc" },
              "default": true
            },
            {
              "id": "o2",
              "name": { "en": "Brown rice", "fr": "Riz complet" },
              "price_adjustment": 3
            }
          ]
        }
      ]
    },
    {
      "id": "d1004",
      "name": {
        "en": "Grilled Salmon",
        "he": "סלמון צלוי"
      },
      "description": {
        "en": "Wild-caught salmon with lemon-herb sauce, served with roasted potatoes"
      },
      "category_id": "c2",
      "sort_order": 2,
      "price": 68.0,
      "nutritional_info": {
        "calories": 450,
        "protein": 38,
        "fat": 22,
        "carbohydrates": 25,
        "sugar": 2
      },
      "allergens": ["fish"],
      "tags": ["gluten-free", "dairy-free"],
      "ingredients": [
        { "name": "salmon fillet", "amount_grams": 180 },
        { "name": "potatoes", "amount_grams": 150 },
        { "name": "olive oil", "amount_grams": 15 },
        { "name": "lemon juice", "amount_grams": 10 },
        { "name": "fresh herbs", "amount_grams": 5, "raw_or_cooked": "raw" }
      ]
    }
  ]
}
